<?xml version="1.0" encoding="UTF-8"?>
<xs:schema xmlns:xs="http://www.w3.org/2001/XMLSchema" elementFormDefault="qualified">
  <xs:element name="bib">
    <xs:complexType>
      <xs:sequence>
        <xs:element name="book" maxOccurs="unbounded">
          <xs:complexType>
            <xs:sequence>
              <xs:element name="title" type="xs:string"/>
              <xs:choice>
                <xs:element name="author" type="xs:string" maxOccurs="unbounded"/>
                <xs:element name="editor">
                  <xs:complexType mixed="true">
                    <xs:sequence>
                      <xs:element name="affiliation" type="xs:string" minOccurs="0"/>
                    </xs:sequence>
                  </xs:complexType>
                </xs:element>
              </xs:choice>
              <xs:element name="publisher" type="xs:string"/>
              <xs:element name="price" type="xs:string"/>
            </xs:sequence>
            <xs:attribute name="year" type="xs:string" use="required"/>
          </xs:complexType>
        </xs:element>
      </xs:sequence>
    </xs:complexType>
  </xs:element>
</xs:schema>
